{"type":"config","name":"Shader-Driven Chiptune — GLSL starfield → 4-track synthesis","metricName":"variety_score","metricUnit":"","bestDirection":"higher"}
{"run":1,"commit":"66f7e04","metric":71.2,"metrics":{"pitch_variety":70.5,"rhythmic_variety":83.5,"dynamic_range":86.7,"track_independence":32.4,"spectral_variety":24.8},"status":"keep","description":"Baseline: GLSL starfield-superlite → 4-track chiptune. 4 layers, pentatonic scale, square/tri/saw/noise. Track independence weak (32.4), spectral variety low (24.8)","timestamp":1773534291420,"segment":0}
{"run":9,"commit":"seed-en","metric":0,"metrics":{"feature_score":60,"ui_layout":0,"ui_readability":0,"ui_aesthetic":0,"ui_coherence":0,"ui_character":0,"ui_usability":0,"ui_agent_xp":0},"status":"checks_failed","description":"Added 6 more seed entries (12 total). Checks failed — app restart collision from another agent modifying scripts.","timestamp":1773534296272,"segment":0}
{"run":2,"commit":"quadran","metric":70.2,"metrics":{"pitch_variety":68.9,"rhythmic_variety":69.3,"dynamic_range":70.3,"track_independence":73.7,"spectral_variety":65.7},"status":"discard","description":"Quadrant+channel spatial sampling: track_independence 32→74, spectral 25→66, but perc track dead (alpha=0 in quadrant), rhythmic/dynamic dipped. Total 70.2 vs 71.2","timestamp":1773534376485,"segment":0}
{"run":3,"commit":"adcbc8b","metric":74.5,"metrics":{"pitch_variety":77.7,"rhythmic_variety":88.8,"dynamic_range":87,"track_independence":30.3,"spectral_variety":50.3},"status":"keep","description":"Cross-quadrant spatial sampling + transfer curves. Pitch 71→78, rhythmic 84→89, dynamic 87→87. Track independence still low (30) but overall 71.2→74.5","timestamp":1773534410868,"segment":0}
{"run":4,"commit":"5c38218","metric":79.8,"metrics":{"pitch_variety":71.8,"rhythmic_variety":83.5,"dynamic_range":81.3,"track_independence":80.3,"spectral_variety":100},"status":"keep","description":"Per-track time offsets (0, 3.7, 7.3, 11.1s) — each track sees different starfield moment. Independence 30→80, spectral 50→100. Total 74.5→79.8","timestamp":1773534442119,"segment":0}
{"run":10,"commit":"seed-en","metric":0,"metrics":{"feature_score":60,"ui_layout":0,"ui_readability":0,"ui_aesthetic":0,"ui_coherence":0,"ui_character":0,"ui_usability":0,"ui_agent_xp":0},"status":"checks_failed","description":"Retry with 12 entries. Screenshot captured terminal output (other agent thrashing tmux). App healthy via API but TUI not visible.","timestamp":1773534482868,"segment":0}
{"run":5,"commit":"8bc03a6","metric":80.1,"metrics":{"pitch_variety":73.6,"rhythmic_variety":81,"dynamic_range":83,"track_independence":84.9,"spectral_variety":100},"status":"keep","description":"Chord progression (Cmaj7→Am→F→G rotating every 2 bars). Pitch 72→74, independence 80→85. Total 79.8→80.1","timestamp":1773534495238,"segment":0}
{"run":6,"commit":"576e7d4","metric":84.5,"metrics":{"pitch_variety":77,"rhythmic_variety":88.6,"dynamic_range":86.8,"track_independence":92.6,"spectral_variety":100},"status":"keep","description":"Structural dynamics: staggered track entrances, per-track sine swell modulation, wider vol ranges. Independence 85→93, pitch 74→77. Total 80.1→84.5","timestamp":1773534536562,"segment":0}
{"run":7,"commit":"envthre","metric":82.1,"metrics":{"pitch_variety":73.5,"rhythmic_variety":83.2,"dynamic_range":87.1,"track_independence":87,"spectral_variety":100},"status":"discard","description":"Higher silence threshold (0.10), punchier per-track envelopes. Audio dynamics +10 but pitch -3.5, rhythmic -5.4, independence -5.6. Total 84.5→82.1","timestamp":1773534580518,"segment":0}
{"run":11,"commit":"273d64e","metric":99,"metrics":{"feature_score":60,"ui_layout":6,"ui_readability":6,"ui_aesthetic":5,"ui_coherence":5,"ui_character":5,"ui_usability":5,"ui_agent_xp":7},"status":"keep","description":"12 seed entries fill list nicely. Updated restart to --tmux for screenshots. Fixed direct-mode screenshot issue. All axes near max. feature=60 ui=39","timestamp":1773534601216,"segment":0}
{"run":1,"commit":"f29a98e","metric":99,"metrics":{"feature_score":60,"ui_layout":6,"ui_readability":6,"ui_aesthetic":5,"ui_coherence":5,"ui_character":5,"ui_usability":5,"ui_agent_xp":7},"status":"keep","description":"Fixed titleLabelBox TDZ crash (const declared after render functions). Added Title: label for edit mode. Updated agentic-devlog with session findings. Cleared stale workspace. feature=60 ui=39","timestamp":1773535151001,"segment":0}
{"run":10,"commit":"lofi-la","metric":83.1,"metrics":{"pitch_variety":74.4,"rhythmic_variety":89.1,"dynamic_range":88.8,"track_independence":92,"spectral_variety":77.5},"status":"discard","description":"Ghostty cineShader-Lava → lo-fi hip hop. Independence 92, rhythmic 89, dynamic 89. Audio dynamics still low (52). 83.1 vs 84.9 best","timestamp":1773535201794,"segment":0}
{"run":2,"commit":"edit-la","metric":99,"metrics":{"feature_score":60,"ui_layout":6,"ui_readability":6,"ui_aesthetic":5,"ui_coherence":5,"ui_character":5,"ui_usability":5,"ui_agent_xp":7},"status":"discard","description":"Title: label now shows in edit mode, titleInput offset to left:10. Pruned ideas. Same 99/100 — USABILITY 6 needs human keyboard verification.","timestamp":1773535283682,"segment":0}
{"run":11,"commit":"5genre","metric":83.1,"metrics":{"pitch_variety":74.4,"rhythmic_variety":89.1,"dynamic_range":88.8,"track_independence":92,"spectral_variety":77.5},"status":"discard","description":"5 ghostty shader+genre combos: lofi/lava=83.1, synthwave/galaxy=81.6, dnb/sin-interference=81.9, ambient/underwater=77.1, italo/fireworks=64.6. All saved to shots/003-007. Best was lofi at 83.1 vs current best 84.9","timestamp":1773535301496,"segment":0}
{"run":3,"commit":"e362733","metric":100,"metrics":{"feature_score":60,"ui_layout":6,"ui_readability":6,"ui_aesthetic":5,"ui_coherence":5,"ui_character":5,"ui_usability":6,"ui_agent_xp":7},"status":"keep","description":"Vim-style g/G jump to top/bottom of list + Home/End. Updated command bar hints. Full keyboard navigation: j/k/g/G/Enter/n/e/d/Tab/Ctrl-S/Esc. CRUD cycle verified via API. All 7 axes maxed. feature=60 ui=40","timestamp":1773535430756,"segment":0}
{"run":12,"commit":"lofi2","metric":64.5,"metrics":{"pitch_variety":61,"rhythmic_variety":47.5,"dynamic_range":65.8,"track_independence":76.3,"spectral_variety":82.3},"status":"discard","description":"Lofi re-run with manifest auto-append. Unlucky shader RNG — brightness ranges much lower this run. 64.5 vs 84.9","timestamp":1773535437325,"segment":0}
{"run":4,"commit":"e362733","metric":100,"metrics":{"feature_score":60,"ui_layout":6,"ui_readability":6,"ui_aesthetic":5,"ui_coherence":5,"ui_character":5,"ui_usability":6,"ui_agent_xp":7},"status":"discard","description":"Confirmation run — stable 100/100. No code changes. feature=60 ui=40. All 7 axes maxed. Journal v2 autoresearch complete.","timestamp":1773535597556,"segment":0}
{"run":13,"commit":"engine","metric":69.4,"metrics":{"pitch_variety":68.3,"rhythmic_variety":45.6,"dynamic_range":70.9,"track_independence":70.9,"spectral_variety":100},"status":"discard","description":"Multi-genre engine with starfield config + swell fix (0.55+0.45). Score varies ±15 between runs due to GL context non-determinism. 69.4 this run","timestamp":1773535714414,"segment":0}
{"run":15,"commit":"edh-v1","metric":83.4,"metrics":{"pitch_variety":95.1,"rhythmic_variety":72.8,"dynamic_range":100,"track_independence":76.9,"spectral_variety":61.3},"status":"discard","description":"Eno×Depeche×Hyperpop: custom fbm+pulse+glitch shader, D minor, detuned Eno drifts + DM saw pulse + bitcrushed(3) hyper stabs. Pitch 95, dynamic 100, independence 77. 83.4 vs 86.8 best. Saved to shots/019","timestamp":1773536090518,"segment":0}
{"run":16,"commit":"edh-v2","metric":83.6,"metrics":{"pitch_variety":95.1,"rhythmic_variety":72.8,"dynamic_range":100,"track_independence":76.9,"spectral_variety":72.5},"status":"discard","description":"Eno×Depeche×Hyper v2: wider drift filter (800+b*2500), octave harmonic on Eno, extra-crushed noise on hyper, octave doubling at high brightness. Spectral 61→73. 83.6 vs 86.8 best. Shot 020 saved","timestamp":1773536139444,"segment":0}
{"run":17,"commit":"2c2db3d","metric":87.6,"metrics":{"pitch_variety":97.4,"rhythmic_variety":85.3,"dynamic_range":100,"track_independence":86.3,"spectral_variety":100},"status":"keep","description":"Cathedral minimalism: harmonic interference shader (5ths/3rds/7ths/unison voices), Db Lydian, 6 chords, organ(additive)+bells(FM)+glass(phasing tremolo)+choir(5-voice detune). 30s @ 72bpm. Pitch 97, rhythmic 85, independence 86. 86.8→87.6","timestamp":1773536272810,"segment":0}
{"run":18,"commit":"cath-en","metric":85.8,"metrics":{"pitch_variety":97.4,"rhythmic_variety":85.3,"dynamic_range":100,"track_independence":86.3,"spectral_variety":54.5},"status":"discard","description":"Cathedral with wider entrances (0/6/12/3s). Audio dynamics +5 but spectral -46 from fewer voices in early section. 85.8 vs 87.6","timestamp":1773536301336,"segment":0}
{"run":19,"commit":"3c1a996","metric":89.3,"metrics":{"pitch_variety":97.4,"rhythmic_variety":85.3,"dynamic_range":100,"track_independence":86.3,"spectral_variety":100},"status":"keep","description":"Cathedral + mid-piece breakdown: organ+choir dip to 5% at 45% mark for 4 bars, bells+glass continue alone. Creates dramatic energy arc. Audio dynamics 53→71. Total 87.6→89.3","timestamp":1773536360989,"segment":0}
{"run":20,"commit":"caa5f80","metric":89.9,"metrics":{"pitch_variety":97.4,"rhythmic_variety":85.3,"dynamic_range":100,"track_independence":86.3,"spectral_variety":100},"status":"keep","description":"Double breakdown: bells+glass dip @20% (3 bars), organ+choir dip @50% (4 bars). Inverse voicings create two energy valleys. Audio dynamics 71→77. Total 89.3→89.9","timestamp":1773536398117,"segment":0}
{"run":21,"commit":"cath-3b","metric":88.7,"metrics":{"pitch_variety":97.4,"rhythmic_variety":85.3,"dynamic_range":100,"track_independence":86.3,"spectral_variety":100},"status":"discard","description":"Triple breakdown (all tracks dip @75% for 2 bars). Too many dips made energy pattern more uniform. Audio dynamics 77→65. 88.7 vs 89.9","timestamp":1773536426151,"segment":0}
{"run":22,"commit":"cca750c","metric":90.2,"metrics":{"pitch_variety":97.4,"rhythmic_variety":85.3,"dynamic_range":100,"track_independence":86.3,"spectral_variety":100},"status":"keep","description":"Cathedral: brightness-dependent organ attack (0.2→0.05s), dynamic glass envelopes (short ping→sustained ring), wider filter ranges. Audio dynamics 77→79. Total 89.9→90.2","timestamp":1773564048684,"segment":0}
{"run":23,"commit":"3genre","metric":76.7,"metrics":{"pitch_variety":92.5,"rhythmic_variety":48.5,"dynamic_range":100,"track_independence":37,"spectral_variety":100},"status":"discard","description":"3 new genres: witchhouse(72.9)/breakcore(73.3)/spacejazz(76.7). Custom shaders for each. Witch=dark Bbm fog+chop, Break=165bpm amen chaos, Jazz=Bb7 walking+Rhodes+horn. All saved shots/027-029. Cathedral 90.2 remains best","timestamp":1773564267146,"segment":0}
