{"type":"config","name":"Antopolis UI Quality","metricName":"ui_score","metricUnit":"","bestDirection":"higher"}
{"run":1,"commit":"f4cc38d","metric":5.4,"metrics":{"layout":5,"readability":5,"aesthetic":5,"coherence":6,"character":6},"status":"keep","description":"Baseline: Antopolis current state. Charming building art and ant glyphs but window undersized, log area empty, monochrome.","timestamp":1773401693702,"segment":0}
{"run":2,"commit":"ffc1820","metric":6.8,"metrics":{"layout":7,"readability":6,"aesthetic":7,"coherence":7,"character":7},"status":"keep","description":"Responsive sizing fills desktop, figlet ANTOPOLIS header, theme tokens throughout, accent borders, Colony Log with border, 4fr:1fr district ratio","timestamp":1773401905268,"segment":0}
{"run":3,"commit":"e5588f7","metric":7,"metrics":{"layout":7,"readability":7,"aesthetic":7,"coherence":7,"character":7},"status":"keep","description":"Census by caste in resource bar (right-aligned), day icon in status bar, enhanced decree/danger formatting","timestamp":1773401978654,"segment":0}
{"run":4,"commit":"c969f32","metric":7.4,"metrics":{"layout":7,"readability":7,"aesthetic":8,"coherence":7,"character":8},"status":"keep","description":"Per-district border colours (yellow/green/cyan/magenta), 8 seed events fill Colony Log on startup","timestamp":1773402061853,"segment":0}
{"run":5,"commit":"c969f32","metric":7.4,"metrics":{"layout":7,"readability":7,"aesthetic":8,"coherence":7,"character":8},"status":"discard","description":"Add subtitle row with building count and per-district census. Informative but no visual score improvement.","timestamp":1773402132438,"segment":0}
{"run":6,"commit":"ef4a758","metric":8.2,"metrics":{"layout":8,"readability":8,"aesthetic":8,"coherence":8,"character":9},"status":"keep","description":"Visual overhaul: 2-char ant glyphs, larger 4-row buildings with silhouettes, distinct terrain textures per district (industrial grit, residential burrows, plaza clean, mines ore), subtitle row with census","timestamp":1773402279132,"segment":0}
{"run":7,"commit":"1b32f39","metric":8.4,"metrics":{"layout":8,"readability":8,"aesthetic":9,"coherence":8,"character":9},"status":"keep","description":"Ant trails (fading footprint commas show movement history), colour-coded Colony Log entries (white/yellow/red by severity)","timestamp":1773402419966,"segment":0}
{"run":8,"commit":"ba923ba","metric":8.6,"metrics":{"layout":8,"readability":8,"aesthetic":9,"coherence":9,"character":9},"status":"keep","description":"Dotted paths between buildings (L-shaped routes connecting infrastructure), makes districts feel like real places with road networks","timestamp":1773402480491,"segment":0}
{"run":9,"commit":"b046711","metric":8.8,"metrics":{"layout":8,"readability":9,"aesthetic":9,"coherence":9,"character":9},"status":"keep","description":"Shorter district labels (drop subtitle, keep counts), pipe separators in resource bar for scanability","timestamp":1773402599374,"segment":0}
{"run":10,"commit":"b046711","metric":8.8,"metrics":{"layout":8,"readability":9,"aesthetic":9,"coherence":9,"character":9},"status":"discard","description":"Static terrain backgrounds (remove tick from seed), focus mode [z] to cycle single-district view. User-requested but no score change.","timestamp":1773402790053,"segment":0}
{"run":11,"commit":"f934f9f","metric":9,"metrics":{"layout":9,"readability":9,"aesthetic":9,"coherence":9,"character":9},"status":"keep","description":"Static terrain (remove tick from bg seed), focus mode [z] to cycle districts, hide figlet in focus, 3fr:1fr district/log ratio for better balance, all seed events visible","timestamp":1773402891480,"segment":0}
{"run":12,"commit":"f4f2b0b","metric":9.2,"metrics":{"layout":9,"readability":9,"aesthetic":9,"coherence":9,"character":10},"status":"keep","description":"Marching ants animation beside figlet header, heartbeat pulse in status bar, ant glyph in Colony Log label. Micro-details that push character to 10.","timestamp":1773403035309,"segment":0}
{"run":13,"commit":"4ea495f","metric":9.6,"metrics":{"layout":9,"readability":10,"aesthetic":10,"coherence":9,"character":10},"status":"keep","description":"Colour-coded ants by caste (red soldiers, cyan engineers, yellow queen, magenta scientists, white workers), dynamic mood subtitle, tags enabled on districts. Three axes at 10.","timestamp":1773403184298,"segment":0}
{"run":14,"commit":"e55ab32","metric":9.8,"metrics":{"layout":9,"readability":10,"aesthetic":10,"coherence":10,"character":10},"status":"keep","description":"Colour-coded resource bar (green food, magenta crystals, yellow energy) matching district border colours. Coloured census counts. Resource-to-district colour mapping creates visual information architecture. Four axes at 10.","timestamp":1773403294850,"segment":0}
