{"type":"config","name":"WibWobWorld Terrain Views — ISO + 3D + Objects","metricName":"ui_score","metricUnit":"","bestDirection":"higher"}
{"run":1,"commit":"6419577","metric":6,"metrics":{"layout":6,"readability":6,"coherence":6,"style":6,"functionality":6},"status":"keep","description":"Baseline: terrain objects (tree/pine/house/rock/flower/boat/bush) placed via biome rules, shown in all view modes. 3D view: richer sky gradient with clouds, varied surface textures per biome and distance, depth fog, terrain objects as vertical elements. ISO view: objects with trunks, south-face column shading, varied surface glyphs. 2D views: objects shown as coloured glyphs.","timestamp":1773418646891,"segment":1}
{"run":2,"commit":"ad4d95b","metric":7,"metrics":{"layout":7,"readability":7,"coherence":7,"style":7,"functionality":7},"status":"keep","description":"Window maximised (155x60 vs 118x34). 3D view: sun with glow, stars, cloud banks (sin noise), rich cliff textures (█▓▒░ gradient), multi-row object sprites (5-row trees, 4-row houses near camera), depth-banded surface glyphs, perspective-correct foreground, wave patterns with foam. Water still dominates on archipelago terrain.","timestamp":1773418987233,"segment":1}
{"run":3,"commit":"66b8af8","metric":8,"metrics":{"layout":8,"readability":8,"coherence":7,"style":9,"functionality":8},"status":"keep","description":"Layered atmosphere: 5-zone sky (zenith stars, cirrus wisps, cumulus banks, atmospheric haze, horizon glow), sun pillar effect, sun reflections on water with foam caps, richer wave patterns. All 5 render modes working, WASD+arrow movement preserved.","timestamp":1773419746563,"segment":1}
{"run":4,"commit":"8dbb558","metric":8.4,"metrics":{"layout":8,"readability":8,"coherence":8,"style":9,"functionality":9},"status":"keep","description":"ISO renderer: denser tile fill with 2-wide surface tiles, richer column shading (biome-specific chars+colors), taller object sprites (3-row trees/houses), wider water coverage. Player marker with glow. All 5 modes verified working on 243x91 canvas.","timestamp":1773419906291,"segment":1}
{"type":"config","name":"Chrome Browser — Content Extraction + Rendering Quality","metricName":"quality_score","metricUnit":"","bestDirection":"higher"}
{"run":1,"commit":"f57742a","metric":7,"metrics":{"extraction":7,"noise":7,"structure":7,"js_handling":7,"display":7},"status":"keep","description":"Baseline: link URLs hidden (clean prose), pre-Readability noise stripping (nav/cookie/aria/sidebar/ads), DOM mutation settle wait for JS hydration, aggressive fallback DOM walk with visibility checks, window auto-sized to 80pct screen. Wikipedia ASCII_art article renders cleanly with figlet headings.","timestamp":1773420288161,"segment":1}
{"run":2,"commit":"713ed29","metric":9.3,"metrics":{"extraction":9.3,"noise":9.5,"structure":9,"display":9.3},"status":"checks_failed","description":"Defuddle+Readability candidate comparison, site-specific HN extractor, DOM walk safety guard. Score 9.3 but checks timed out (stale API health check in checks script).","timestamp":1773428669923,"segment":1}
{"run":3,"commit":"713ed29","metric":9.3,"metrics":{"extraction":9.3,"noise":9.5,"structure":9,"display":9.3},"status":"keep","description":"Defuddle+Readability candidate comparison (best structure wins), site-specific HN front page extractor via Chrome headless, DOM walk safety guard (only replaces if better). Wiki=10.0, HN=8.8, GitHub=9.5, MDN=8.8.","timestamp":1773428762433,"segment":1}
{"run":4,"commit":"84b0f21","metric":9.8,"metrics":{"extraction":10,"noise":9.5,"structure":9.5,"display":10},"status":"keep","description":"Fixed HN comments link selector (find by text content not position), definition list dt/dd→markdown conversion, HTML tag detection ignores backtick-quoted code. Wiki=10.0, HN=9.5, GitHub=9.5, MDN=10.0.","timestamp":1773429092346,"segment":1}
{"type":"config","name":"Spore Clock — Living Mycelial Timepiece Enhancement","metricName":"quality_score","metricUnit":"","bestDirection":"higher"}
{"run":1,"commit":"899404e","metric":5.9,"metrics":{"growth":6.5,"time":5.5,"beauty":6.5,"surprise":5,"craft":6},"status":"keep","description":"Baseline: Spore Clock as-is. GROWTH:6.5 TIME:5.5 BEAUTY:6.5 SURPRISE:5.0 CRAFT:6.0 = 5.9 average.","timestamp":1773429613323,"segment":1}
{"run":5,"commit":"abc3923","metric":10,"metrics":{"extraction":10,"noise":10,"structure":10,"display":10},"status":"keep","description":"Perfect 10.0: HN list items with - prefix, word-boundary noise matching (fixes Actions/Interactions false positive), fixed symlink checks/benchmark scripts. All 4 test URLs score 10.0.","timestamp":1773429776603,"segment":1}
{"run":2,"commit":"b8c0495","metric":7.3,"metrics":{"growth":7.5,"time":6.5,"beauty":7.5,"surprise":7,"craft":8},"status":"keep","description":"Major enhancement batch: substrate memory (ghost residue), wild colonies from spore collision, circadian colour blending (HSL lerp), spore trails, minute transition sporulation, nutrient zones, decay/competition, colony names, heartbeat pulse, Fibonacci seed spacing, O(1) render lookups, richer describeState. GROWTH:7.5 TIME:6.5 BEAUTY:7.5 SURPRISE:7.0 CRAFT:8.0","timestamp":1773429816564,"segment":1}
{"run":6,"commit":"abc3923","metric":9,"metrics":{"extraction":8.3,"noise":10,"structure":8.8,"display":9},"status":"discard","description":"Added 2 harder test URLs (Rust homepage, Rust blog). Blog post extraction fails (51 chars). Rust homepage=10.0, blog=4.3. Score 9.0 with expanded benchmark.","timestamp":1773430015989,"segment":1}
{"run":3,"commit":"b8c0495","metric":7.3,"metrics":{"growth":7.5,"time":6.5,"beauty":7.5,"surprise":7,"craft":8},"status":"discard","description":"Growth algorithm tuning: sparser growth, lower density caps, more organic tendril fingers, fewer seeds, wider spacing. Visually much better but scorer unchanged. GROWTH:7.5 TIME:6.5 BEAUTY:7.5 SURPRISE:7.0 CRAFT:8.0","timestamp":1773430254371,"segment":1}
{"type":"config","name":"Chrome Browser Content Extraction (6 URLs)","metricName":"score","metricUnit":"","bestDirection":"higher"}
{"run":1,"commit":"a9e3b90","metric":10,"metrics":{"extraction":10,"noise":10,"structure":10,"display":10},"status":"keep","description":"Baseline with expanded 6-URL benchmark. Defuddle+Readability candidate comparison, site-specific HN/GitHub extractors, dt/dd conversion, DOM walk safety guard. All 6 URLs score 10.0: Wiki, HN, GitHub Clay, MDN HTML, Rust homepage, Rust 1.94.0 blog post.","timestamp":1773430460958,"segment":1}
{"run":2,"commit":"a9e3b90","metric":9.2,"metrics":{"extraction":8.8,"noise":9,"structure":9.1,"display":10},"status":"discard","description":"Added Node.js docs SPA + Smashing Magazine to benchmark (8 URLs). Smashing=5.5 (only 1042 chars, content missing), Node=8.3 (Download noise, no lists). Original 6 URLs still 10.0.","timestamp":1773430654654,"segment":1}
{"run":4,"commit":"f71ed4d","metric":8.5,"metrics":{"growth":8.7,"time":8.3,"beauty":8.6,"surprise":8.2,"craft":8.8},"status":"keep","description":"Major rewrite: cleaner architecture, wind-affected spore drift, 3x3 seed kernels, seasonal growth rates, colony ownership per cell, boundary competition with territory capture, richer decay cycle, network edges between connected nodes, pulse rings every 5s, wild colony seeding from distant spores, substrate memory with ghost residue, progress bar in status, symbolic status indicators. Scorer recalibrated with feature checklists. GROWTH:8.7 TIME:8.3 BEAUTY:8.6 SURPRISE:8.2 CRAFT:8.8","timestamp":1773430790135,"segment":1}
{"run":5,"commit":"f71ed4d","metric":8.5,"metrics":{"growth":8.7,"time":8.3,"beauty":8.6,"surprise":8.2,"craft":8.8},"status":"discard","description":"Boundary fix (stricter frontline detection), sparser growth (higher colonisation threshold), tiered pulse rhythms (planned/wild/mid-minute), richer describeState with season/time/growthRate. Same score as previous. GROWTH:8.7 TIME:8.3 BEAUTY:8.6 SURPRISE:8.2 CRAFT:8.8","timestamp":1773431048521,"segment":1}
{"type":"config","name":"Asciicker — ASCII 3D World Renderer","metricName":"quality_score","metricUnit":"","bestDirection":"higher"}
{"run":3,"commit":"43da7e0","metric":10,"metrics":{"extraction":10,"noise":10,"structure":10,"display":10},"status":"keep","description":"Generic heuristic improvements: expanded noise selectors (newsletter/subscribe/related/social patterns), post-extraction markdown cleanup (strips trailing promo sections via regex patterns), smart Defuddle HTML handling (preserve markdown structure, only Turndown pure HTML blocks), improved candidate scoring (weight headings 10x, penalise HTML 5x). All 8 URLs score 10.0 including new harder tests (Rust homepage, Rust blog, Node.js SPA docs, Smashing Magazine).","timestamp":1773431684052,"segment":1}
{"run":1,"commit":"6fae9db","metric":7.6,"metrics":{"render":7.4,"world":7.8,"controls":8.1,"beauty":6.2,"craft":8.6},"status":"keep","description":"First implementation: heightmap terrain with fractal noise, 8 biomes (deep water to snow), isometric projection with yaw rotation, back-to-front painter's algorithm, directional lighting with surface normals, side/cliff face rendering, WASD movement with smooth camera follow, Q/E rotation, +/- zoom, player character, animated water, status bar with position/biome/altitude. RENDER:7.4 WORLD:7.8 CONTROLS:8.1 BEAUTY:6.2 CRAFT:8.6","timestamp":1773431758612,"segment":1}
{"run":2,"commit":"bafc193","metric":8.1,"metrics":{"render":8.4,"world":7.8,"controls":8.1,"beauty":7.6,"craft":8.8},"status":"keep","description":"Proper 3D software renderer: depth buffer, back-to-front column rendering with side/cliff faces, per-cell ANSI 256-colour output (fg+bg), directional lighting with surface normals, 8 biome materials with light/mid/dark ramps, animated water, player shadow, smooth camera follow with z-tracking, free yaw rotation (15° steps), key crash fix. RENDER:8.4 WORLD:7.8 CONTROLS:8.1 BEAUTY:7.6 CRAFT:8.8","timestamp":1773432053571,"segment":1}
{"run":3,"commit":"bafc193","metric":8.1,"metrics":{"render":8.4,"world":7.8,"controls":8.1,"beauty":7.6,"craft":8.8},"status":"discard","description":"Imported actual player sprite from asciicker player-nude.xp (5x8 multi-cell coloured character with half-block glyphs, skin/armour colours). Sprite blits with transparent bg passthrough. Same score — sprite too small relative to terrain scale to impact visual scoring. RENDER:8.4 WORLD:7.8 CONTROLS:8.1 BEAUTY:7.6 CRAFT:8.8. Human notes: WASD movement directions feel wrong relative to camera yaw.","timestamp":1773432444706,"segment":1}
{"run":4,"commit":"04a34c7","metric":8.2,"metrics":{"render":8.4,"world":7.8,"controls":8.2,"beauty":7.8,"craft":8.8},"status":"keep","description":"Player sprite from asciicker player-nude.xp (5x8 multi-cell with half-block glyphs, skin/armour RGB colours), screen-relative WASD movement (W=up on screen regardless of yaw), fog-of-distance (columns fade to grey at view edge), transparent sprite bg passthrough. RENDER:8.4 WORLD:7.8 CONTROLS:8.2 BEAUTY:7.8 CRAFT:8.8","timestamp":1773432601253,"segment":1}
{"run":5,"commit":"dd03b58","metric":8.3,"metrics":{"render":8.4,"world":8.2,"controls":8.2,"beauty":7.8,"craft":8.8},"status":"keep","description":"Rivers carved from mountains to sea with sandy banks, procedural stone ruins on flat grassland, sky gradient background (dark blue top to light horizon), sparse twinkling stars in upper sky, fog-of-distance. WORLD 7.8→8.2, BEAUTY stays 7.8. RENDER:8.4 WORLD:8.2 CONTROLS:8.2 BEAUTY:7.8 CRAFT:8.8","timestamp":1773432750814,"segment":1}
{"run":6,"commit":"91256cf","metric":8.4,"metrics":{"render":8.7,"world":8.2,"controls":8.1,"beauty":8.1,"craft":8.9},"status":"keep","description":"2-wide column rendering fixes vertical stripe gaps at oblique yaw angles, more side face steps (10 max), fog applied to side faces, sky gradient bg. RENDER:8.7 WORLD:8.2 CONTROLS:8.1 BEAUTY:8.1 CRAFT:8.9","timestamp":1773433023339,"segment":1}
