{"type":"config","name":"Unix Control Brief Enhancement","metricName":"quality_score","metricUnit":"","bestDirection":"higher"}
{"run":1,"commit":"a9dfe7e","metric":4.3,"metrics":{"evidence":4.2,"actionability":6.8,"coherence":3.5,"density":3.8,"rigour":3},"status":"keep","description":"Baseline score: E4.2 A6.8 C3.5 D3.8 R3.0. Weakest: RIGOUR — fabricated benchmarks cited as empirical throughout suite.","timestamp":1773435662608,"segment":0}
{"run":2,"commit":"rigor1","metric":4,"metrics":{"evidence":3,"actionability":7,"coherence":3,"density":3.5,"rigour":3.5},"status":"discard","description":"Fixed RESEARCH rigour (flagged fabricated benchmarks) but EVIDENCE still claims them as verified — created contradiction. Need to fix all files together.","timestamp":1773435870179,"segment":0}
{"run":3,"commit":"933384d","metric":4.9,"metrics":{"evidence":4.5,"actionability":7.2,"coherence":3.8,"density":3.5,"rigour":5.5},"status":"keep","description":"Comprehensive rigour fix across ALL files: flagged fabricated benchmarks, unverified citations, removed false precision. R3.0->5.5, E4.2->4.5, C3.5->3.8.","timestamp":1773436132131,"segment":0}
{"run":4,"commit":"742237f","metric":5.1,"metrics":{"evidence":4.8,"actionability":7,"coherence":4.2,"density":3.8,"rigour":5.5},"status":"keep","description":"Gutted INDEX from 413 lines to 45 lines. Pure navigation, no repeated findings. C3.8->4.2, E4.5->4.8.","timestamp":1773436174155,"segment":0}
{"run":5,"commit":"dense1","metric":4.7,"metrics":{"evidence":4.5,"actionability":7.5,"coherence":3.5,"density":3,"rigour":5},"status":"discard","description":"Trimmed RESEARCH sections 4,5,9,10 for density but RECOMMENDATIONS still has fabricated percentages creating coherence regression. C4.2->3.5, R5.5->5.0.","timestamp":1773436337565,"segment":0}
{"run":6,"commit":"d961ff5","metric":5.1,"metrics":{"evidence":5.2,"actionability":7.5,"coherence":3.8,"density":3.5,"rigour":5.5},"status":"keep","description":"Fixed RECOMMENDATIONS: removed fabricated percentages, trimmed week-by-week roadmap, removed duplicate REST-vs-CLI example. E4.8->5.2, R5.5 held.","timestamp":1773436442303,"segment":0}
{"run":7,"commit":"a6ba022","metric":5.5,"metrics":{"evidence":5.2,"actionability":7.8,"coherence":4.5,"density":4,"rigour":6},"status":"keep","description":"Consolidated RESEARCH sections 1-3: replaced detailed project writeups with table referencing EVIDENCE, trimmed tool-calling section, condensed virtual filesystem section. C4.2->4.5, D3.5->4.0, R5.5->6.0.","timestamp":1773436582016,"segment":0}
{"run":8,"commit":"a5e4281","metric":5.6,"metrics":{"evidence":5.2,"actionability":7.5,"coherence":4.8,"density":4.2,"rigour":6.5},"status":"keep","description":"Rewrote EVIDENCE: removed emojis, killed duplicate sections (reproduction evidence, reading order, tool comparison), pure citations + verification status. C4.5->4.8, D4.0->4.2, R6.0->6.5.","timestamp":1773436654034,"segment":0}
{"run":9,"commit":"89e8665","metric":5.6,"metrics":{"evidence":5.2,"actionability":7.8,"coherence":4.5,"density":4,"rigour":6.5},"status":"keep","description":"Major RESEARCH consolidation: 720->264 lines. Removed duplicate sections 8-13, appendices, references (owned by EVIDENCE). Renumbered to 8 sections.","timestamp":1773436791885,"segment":0}
{"run":10,"commit":"164fd5d","metric":6,"metrics":{"evidence":5.2,"actionability":7.8,"coherence":5.5,"density":4.8,"rigour":6.8},"status":"keep","description":"Trashed SUMMARY (RESEARCH is lean enough to serve both roles). C4.5->5.5, D4.0->4.8, R6.5->6.8. 9 files -> 8.","timestamp":1773436835422,"segment":0}
{"run":11,"commit":"932d8c9","metric":6,"metrics":{"evidence":5.2,"actionability":7.8,"coherence":5.5,"density":4.8,"rigour":6.8},"status":"keep","description":"Rewrote RECOMMENDATIONS: 470->95 lines. Gap analysis + phased plan only, defers implementation to SURFACE_PARITY. Score held at 6.0.","timestamp":1773436899644,"segment":0}
{"run":12,"commit":"c0c2b37","metric":6,"metrics":{"evidence":5.2,"actionability":7.8,"coherence":5.5,"density":4.8,"rigour":6.8},"status":"keep","description":"Tightened RESEARCH sections 4-5: composability argument and WibWob gap now 25 lines total (was 90+). Score held at 6.0, scorer shifted to REFERENCE_CLI_TOOLS_RANKED as density bottleneck.","timestamp":1773436949982,"segment":0}
{"run":13,"commit":"3b5711b","metric":6,"metrics":{"evidence":5.2,"actionability":7.8,"coherence":5.5,"density":4.8,"rigour":6.8},"status":"keep","description":"Compressed REFERENCE_CLI_TOOLS_RANKED: tiers 3-4 to table, trimmed command examples and what-to-steal sections. 393->230 lines. Score held at 6.0.","timestamp":1773437069266,"segment":0}
{"run":14,"commit":"765ad2e","metric":6.4,"metrics":{"evidence":5.5,"actionability":8,"coherence":6,"density":5.5,"rigour":7},"status":"keep","description":"Merged devnotes into parent docs, trashed both. 8->6 files, 1291->1009 lines. A hit 8.0 threshold! C5.5->6.0, D4.8->5.5, R6.8->7.0.","timestamp":1773437208523,"segment":0}
{"run":15,"commit":"2244271","metric":6.4,"metrics":{"evidence":5.5,"actionability":8,"coherence":6,"density":5.5,"rigour":7},"status":"keep","description":"Compressed REFERENCE_CLI_TOOLS_RANKED tier 1-2: removed per-axis scoring tables, single-paragraph per tool. 915 lines total. Score held at 6.4.","timestamp":1773437319258,"segment":0}
{"run":16,"commit":"5890753","metric":6.7,"metrics":{"evidence":5.8,"actionability":7.8,"coherence":6.5,"density":6,"rigour":7.2},"status":"keep","description":"Aggressive consolidation: merged EVIDENCE into RESEARCH, RECOMMENDATIONS into SURFACE_PARITY, trashed INDEX. 6->3 files, 915->642 lines. C6.0->6.5, D5.5->6.0, R7.0->7.2.","timestamp":1773437431601,"segment":0}
{"run":17,"commit":"00e37ad","metric":6.8,"metrics":{"evidence":5.8,"actionability":7.8,"coherence":6.8,"density":6.2,"rigour":7.5},"status":"keep","description":"Trimmed SURFACE_PARITY: compressed options B/C/D, multi-agent, packages sections. RIGOUR hit 7.5 threshold! C6.5->6.8, D6.0->6.2. 545 lines in 3 files.","timestamp":1773437503235,"segment":0}
{"run":18,"commit":"b9be466","metric":6.9,"metrics":{"evidence":5.8,"actionability":7.8,"coherence":6.8,"density":6.8,"rigour":7.5},"status":"keep","description":"Rewrote SURFACE_PARITY: 265->115 lines. Killed redundant prose, kept code and architecture. D6.2->6.8. 394 lines total in 3 files (was 3231 in 9).","timestamp":1773437620324,"segment":0}
{"run":19,"commit":"61fd7bd","metric":7,"metrics":{"evidence":5.8,"actionability":7.8,"coherence":7,"density":7,"rigour":7.5},"status":"keep","description":"Merged RESEARCH sections 3-6 into one Analysis section. 371 lines in 3 files. C7.0, D7.0, R7.5. Need C+0.5, D+0.5, A+0.2 to graduate.","timestamp":1773437695223,"segment":0}
{"run":20,"commit":"53464d5","metric":7.4,"metrics":{"evidence":6.2,"actionability":7.8,"coherence":7.5,"density":7.5,"rigour":7.8},"status":"keep","description":"Tightened takeaways, removed fabricated sources section, added test-it-now examples. C7.5 D7.5 R7.8 all pass! A7.8 needs 8.0 — one more push.","timestamp":1773437748339,"segment":0}
{"run":21,"commit":"18deb5a","metric":7.5,"metrics":{"evidence":6.5,"actionability":8,"coherence":7.5,"density":7.5,"rigour":8},"status":"keep","description":"PHASE 1 GRADUATED! Added copy-paste Phase 1 code + success metrics. A8.0 C7.5 D7.5 R8.0 — all thresholds met. 3 files, 395 lines (was 9 files, 3231 lines).","timestamp":1773437791473,"segment":0}
{"type":"config","name":"Unix CLI Surface — ww tool parity + coverage","metricName":"parity_score","metricUnit":"","bestDirection":"higher"}
{"run":1,"commit":"e409e1c","metric":10,"metrics":{"tests_pass":15,"tests_total":15},"status":"keep","description":"Baseline: ww CLI created + 15/15 tests pass. Basic parity (commands, state, windows), 3 syntax styles, flag parsing, jq ergonomics, error handling.","timestamp":1773438017705,"segment":0}
{"run":2,"commit":"e7f9373","metric":10,"metrics":{"tests_pass":21,"tests_total":21},"status":"keep","description":"Expanded test suite: 15->21 tests. Added resize, theme.set, pipe composition (open+filter+close editors via jq), error to stderr, no-args help. All pass.","timestamp":1773438054971,"segment":0}
{"run":3,"commit":"72a7771","metric":8.4,"metrics":{"tests_pass":21,"tests_total":25},"status":"keep","description":"Added 4 harder tests (positional ID, quiet mode, screenshot). 21/25 pass. Need: positional args, -q flag, screenshot subcommand.","timestamp":1773438108847,"segment":0}
{"run":4,"commit":"95c3267","metric":10,"metrics":{"tests_pass":25,"tests_total":25},"status":"keep","description":"Implemented 4 features: positional window ID (ww window 3 close), -q/--quiet mode, screenshot subcommand. 25/25 tests pass.","timestamp":1773438180607,"segment":0}
{"run":5,"commit":"594b281","metric":10,"metrics":{"tests_pass":30,"tests_total":30},"status":"keep","description":"30/30 tests pass. Fixed theme state path, proper -q for commands, string flag parsing, multi-window workflows, env override, quiet+xargs pipe.","timestamp":1773438254817,"segment":0}
{"run":6,"commit":"8aed4d4","metric":10,"metrics":{"tests_pass":34,"tests_total":34},"status":"keep","description":"34/34 tests. Added agent workflows (selective close by kind, tile verify, document open with filePath), focused window check, env override, devlog entry.","timestamp":1773438379310,"segment":0}
{"run":7,"commit":"98ff5e1","metric":10,"metrics":{"tests_pass":39,"tests_total":39},"status":"keep","description":"39/39 tests. Added full command ID parity check, figlet banner, deep state JSON comparison, exit codes. ww CLI is functionally complete.","timestamp":1773438423023,"segment":0}
{"run":8,"commit":"0bbaa4d","metric":10,"metrics":{"tests_pass":42,"tests_total":42},"status":"keep","description":"42/42 tests. Added rapid-fire open/close cycle, bun run ww shortcut, package.json script entry. CLI feature-complete with full parity.","timestamp":1773438479682,"segment":0}
{"run":9,"commit":"37476bd","metric":10,"metrics":{"tests_pass":48,"tests_total":48},"status":"keep","description":"48/48 tests. Added JSON validity checks on all subcommands, microapp command parity. CLI is production-ready for E039.","timestamp":1773438547968,"segment":0}
{"run":10,"commit":"da1c871","metric":10,"metrics":{"tests_pass":50,"tests_total":50},"status":"keep","description":"50/50 tests. Added cascade layout, desktop.clear-all, E040 music video epic brief captured. CLI comprehensive and stable.","timestamp":1773438720540,"segment":0}
{"run":11,"commit":"a8b2832","metric":10,"metrics":{"tests_pass":53,"tests_total":53},"status":"keep","description":"53/53 tests. Added E040 choreography proof: theme+figlet+editors+tile+move+clear in sequence. CLI is production-ready and music-video-capable.","timestamp":1773438771750,"segment":0}
{"run":12,"commit":"11637e6","metric":10,"metrics":{"tests_pass":53,"tests_total":53},"status":"keep","description":"Added src/cli/README.md — technical architecture note (parity-by-construction via HTTP, no catalog import), usage guide, piping examples, agent workflow patterns. 53/53 still green.","timestamp":1773438886404,"segment":0}
{"run":13,"commit":"fff2290","metric":10,"metrics":{"tests_pass":53,"tests_total":53},"status":"keep","description":"README: added doc generation recipes (jq from live API), name conflict audit (ww is safe for PATH, scoped pkg needed for npm publish).","timestamp":1773438958372,"segment":0}
{"run":14,"commit":"f595c2d","metric":10,"metrics":{"tests_pass":53,"tests_total":53},"status":"keep","description":"Renamed CLI from ww to wibwob (ww conflicts with existing zsh alias). ww.ts -> wibwob.ts, all tests/docs/scripts updated. 53/53 pass.","timestamp":1773439167234,"segment":0}
{"run":15,"commit":"50d367c","metric":10,"metrics":{"tests_pass":53,"tests_total":53},"status":"keep","description":"Rewrote README from scratch — all ww refs replaced with wibwob, setup section with alias instruction, consistent examples throughout.","timestamp":1773439438366,"segment":0}
{"run":16,"commit":"a30e436","metric":10,"metrics":{"tests_pass":53,"tests_total":53},"status":"keep","description":"Fixed all remaining ww refs in wibwob.ts help text and comments. Zero ww references left in codebase. 53/53 pass.","timestamp":1773439523480,"segment":0}
{"run":17,"commit":"ec16d6a","metric":10,"metrics":{"tests_pass":53,"tests_total":53},"status":"keep","description":"Created autoresearch/unix-control-v2/BACKLOG.md — 7 items prioritised: Zod schemas, CI parity, per-command help, return types, tab completion, event streaming, benchmarks.","timestamp":1773439574574,"segment":0}
{"run":18,"commit":"52f48db","metric":10,"metrics":{"tests_pass":53,"tests_total":53},"status":"keep","description":"Added naming hygiene checklist to v2 backlog — audit all docs for stale ww refs, grep command included.","timestamp":1773439619497,"segment":0}
{"run":19,"commit":"9075a33","metric":10,"metrics":{"tests_pass":53,"tests_total":53},"status":"keep","description":"Added 'transitive dep' to LINGO.md with Zod example and promote-to-direct rule of thumb.","timestamp":1773439643885,"segment":0}
{"run":20,"commit":"43a2d9a","metric":10,"metrics":{"tests_pass":53,"tests_total":53},"status":"keep","description":"Renamed LINGO.md to LEXICON.md, updated header. No live references to update (only historical devlogs).","timestamp":1773439690523,"segment":0}
{"run":21,"commit":"56d1f20","metric":10,"metrics":{"tests_pass":53,"tests_total":53},"status":"keep","description":"Devlog: added rename friction, TDD-via-autoresearch pattern, human-agent collab observations, architecture doc reality check. V2 backlog: added doc update item.","timestamp":1773439774267,"segment":0}
{"run":22,"commit":"e72b3f7","metric":10,"metrics":{"tests_pass":53,"tests_total":53},"status":"keep","description":"V2 backlog item 10: dogfood wibwob in the test suite itself, replacing raw curl. Keep one curl check for HTTP parity proof.","timestamp":1773439790982,"segment":0}
